{
  "difficulty": "easy",
  "targetAge": {
    "min": 5,
    "max": 8
  },
  "characters": [
    {
      "characterId": "child",
      "role": "learner",
      "name": "사용자"
    },
    {
      "characterId": "friend",
      "role": "ai_partner",
      "name": "하은",
      "personality": "friendly"
    }
  ],
  "emotionRules": [
    {
      "emotion": "positive",
      "keywords": [
        "좋아",
        "재밌어",
        "기뻐",
        "고마워"
      ],
      "feedback": "밝은 마음을 말로 표현했어요."
    },
    {
      "emotion": "negative",
      "keywords": [
        "싫어",
        "무서워",
        "속상해",
        "화나"
      ],
      "feedback": "불편한 마음을 말로 표현한 것은 좋아요."
    },
    {
      "emotion": "passive",
      "keywords": [
        "몰라",
        "음",
        "..."
      ],
      "feedback": "짧게라도 반응하려는 시도를 확인했어요."
    }
  ],
  "scenarioId": "playroom_emotion_005",
  "title": "친구가 도와줘서 고마운 마음 말하기",
  "category": "emotion_expression",
  "description": "친구가 도와준 상황에서 아동이 고마운 마음을 말로 표현하는 시나리오",
  "learningGoal": [
    "고마운 마음 표현하기",
    "친구의 도움에 반응하기",
    "대화 이어가기"
  ],
  "targetSkills": [
    "emotion_expression",
    "conversation_continuation"
  ],
  "context": {
    "place": "kindergarten_playroom",
    "situation": "친구가 떨어진 블록을 주워준 상황",
    "background": "친구가 블록을 건네며 웃고 있다."
  },
  "dialogueFlow": [
    {
      "stepId": "step_001",
      "speaker": "ai_partner",
      "utterance": "여기 떨어진 블록 주웠어.",
      "expectedUserIntent": [
        "positive_emotion",
        "conversation_continuation"
      ],
      "acceptableResponses": [
        "고마워",
        "고마워 하은아",
        "좋아"
      ],
      "hint": "친구에게 고맙다고 말해보세요.",
      "emotionTarget": "positive",
      "nextStep": "step_002"
    },
    {
      "stepId": "step_002",
      "speaker": "ai_partner",
      "utterance": "우리 이 블록도 같이 써볼까?",
      "expectedUserIntent": [
        "accept_invitation",
        "reject_invitation",
        "sharing"
      ],
      "acceptableResponses": [
        "응",
        "좋아",
        "같이 쓰자",
        "아니"
      ],
      "hint": "같이 쓸지 말해보세요.",
      "emotionTarget": "neutral",
      "nextStep": "end"
    }
  ],
  "evaluationCriteria": {
    "intentMatched": true,
    "minUtteranceLength": 1,
    "requiredSkill": [
      "emotion_expression",
      "conversation_continuation"
    ],
    "scoringRule": {
      "intentMatch": 40,
      "contextAppropriate": 30,
      "emotionExpression": 30,
      "conversationContinuity": 0
    }
  },
  "metadata": {
    "version": "0.1.0",
    "createdBy": "team",
    "lastUpdated": "2026-06-07",
    "tags": [
      "mvp",
      "peer-interaction",
      "emotion_expression",
      "kindergarten_playroom"
    ]
  }
}
