{
  "difficulty": "easy",
  "targetAge": {
    "min": 5,
    "max": 8
  },
  "characters": [
    {
      "characterId": "child",
      "role": "learner",
      "name": "사용자"
    },
    {
      "characterId": "friend",
      "role": "ai_partner",
      "name": "하은",
      "personality": "friendly"
    }
  ],
  "emotionRules": [
    {
      "emotion": "positive",
      "keywords": [
        "좋아",
        "재밌어",
        "기뻐",
        "고마워"
      ],
      "feedback": "밝은 마음을 말로 표현했어요."
    },
    {
      "emotion": "negative",
      "keywords": [
        "싫어",
        "무서워",
        "속상해",
        "화나"
      ],
      "feedback": "불편한 마음을 말로 표현한 것은 좋아요."
    },
    {
      "emotion": "passive",
      "keywords": [
        "몰라",
        "음",
        "..."
      ],
      "feedback": "짧게라도 반응하려는 시도를 확인했어요."
    }
  ],
  "scenarioId": "playground_emotion_003",
  "title": "새로운 놀이가 어려워서 긴장된 마음 말하기",
  "category": "emotion_expression",
  "description": "처음 해보는 놀이 앞에서 긴장되거나 어려운 마음을 친구에게 표현하는 시나리오",
  "learningGoal": [
    "긴장된 마음 말하기",
    "어려움을 표현하기",
    "쉬고 싶을 때 말하기"
  ],
  "targetSkills": [
    "emotion_expression",
    "refusal"
  ],
  "context": {
    "place": "playground",
    "situation": "친구가 처음 해보는 놀이기구를 같이 하자고 제안한 상황",
    "background": "친구가 낮은 놀이기구 앞에서 아동을 기다리고 있다."
  },
  "dialogueFlow": [
    {
      "stepId": "step_001",
      "speaker": "ai_partner",
      "utterance": "이 놀이기구 같이 해볼래?",
      "expectedUserIntent": [
        "accept_invitation",
        "reject_invitation",
        "negative_emotion"
      ],
      "acceptableResponses": [
        "무서워",
        "긴장돼",
        "싫어",
        "해볼래"
      ],
      "hint": "무섭거나 긴장되면 말해보세요.",
      "emotionTarget": "anxious",
      "nextStep": "step_002"
    },
    {
      "stepId": "step_002",
      "speaker": "ai_partner",
      "utterance": "괜찮아. 천천히 해도 돼.",
      "expectedUserIntent": [
        "emotion_response",
        "refuse_help"
      ],
      "acceptableResponses": [
        "쉬고 싶어",
        "천천히 할래",
        "괜찮아"
      ],
      "hint": "쉬고 싶으면 쉬고 싶다고 말해보세요.",
      "emotionTarget": "neutral",
      "nextStep": "end"
    }
  ],
  "evaluationCriteria": {
    "intentMatched": true,
    "minUtteranceLength": 1,
    "requiredSkill": [
      "emotion_expression",
      "refusal"
    ],
    "scoringRule": {
      "intentMatch": 40,
      "contextAppropriate": 30,
      "emotionExpression": 30,
      "conversationContinuity": 0
    }
  },
  "metadata": {
    "version": "0.1.0",
    "createdBy": "team",
    "lastUpdated": "2026-06-07",
    "tags": [
      "mvp",
      "peer-interaction",
      "emotion_expression",
      "playground"
    ]
  }
}
