{
  "difficulty": "easy",
  "targetAge": {
    "min": 5,
    "max": 8
  },
  "characters": [
    {
      "characterId": "child",
      "role": "learner",
      "name": "사용자"
    },
    {
      "characterId": "friend",
      "role": "ai_partner",
      "name": "하준",
      "personality": "friendly"
    }
  ],
  "emotionRules": [
    {
      "emotion": "positive",
      "keywords": [
        "좋아",
        "재밌어",
        "기뻐",
        "고마워"
      ],
      "feedback": "밝은 마음을 말로 표현했어요."
    },
    {
      "emotion": "negative",
      "keywords": [
        "싫어",
        "무서워",
        "속상해",
        "화나"
      ],
      "feedback": "불편한 마음을 말로 표현한 것은 좋아요."
    },
    {
      "emotion": "passive",
      "keywords": [
        "몰라",
        "음",
        "..."
      ],
      "feedback": "짧게라도 반응하려는 시도를 확인했어요."
    }
  ],
  "scenarioId": "playroom_emotion_002",
  "title": "장난감이 망가져서 속상한 마음 말하기",
  "category": "emotion_expression",
  "description": "장난감이 망가진 상황에서 아동이 속상한 마음을 친구에게 표현하는 시나리오",
  "learningGoal": [
    "속상한 감정 말하기",
    "도움이 필요한 상황 표현하기",
    "친구의 반응 듣기"
  ],
  "targetSkills": [
    "emotion_expression",
    "requesting_help"
  ],
  "context": {
    "place": "kindergarten_playroom",
    "situation": "함께 쓰던 장난감 자동차 바퀴가 빠진 상황",
    "background": "친구가 망가진 자동차를 보고 걱정스러운 표정을 짓고 있다."
  },
  "dialogueFlow": [
    {
      "stepId": "step_001",
      "speaker": "ai_partner",
      "utterance": "자동차가 고장 났네. 너 괜찮아?",
      "expectedUserIntent": [
        "emotion_response",
        "negative_emotion"
      ],
      "acceptableResponses": [
        "속상해",
        "슬퍼",
        "괜찮아",
        "싫어"
      ],
      "hint": "속상하면 속상해라고 말해도 돼요.",
      "emotionTarget": "negative",
      "nextStep": "step_002"
    },
    {
      "stepId": "step_002",
      "speaker": "ai_partner",
      "utterance": "같이 고칠 방법을 찾아볼까?",
      "expectedUserIntent": [
        "accept_help",
        "refuse_help"
      ],
      "acceptableResponses": [
        "응",
        "좋아",
        "아니",
        "내가 할래"
      ],
      "hint": "도움이 필요한지 말해보세요.",
      "emotionTarget": "neutral",
      "nextStep": "end"
    }
  ],
  "evaluationCriteria": {
    "intentMatched": true,
    "minUtteranceLength": 1,
    "requiredSkill": [
      "emotion_expression",
      "requesting_help"
    ],
    "scoringRule": {
      "intentMatch": 40,
      "contextAppropriate": 30,
      "emotionExpression": 30,
      "conversationContinuity": 0
    }
  },
  "metadata": {
    "version": "0.1.0",
    "createdBy": "team",
    "lastUpdated": "2026-06-07",
    "tags": [
      "mvp",
      "peer-interaction",
      "emotion_expression",
      "kindergarten_playroom"
    ]
  }
}
