{
  "difficulty": "easy",
  "targetAge": {
    "min": 5,
    "max": 8
  },
  "characters": [
    {
      "characterId": "child",
      "role": "learner",
      "name": "사용자"
    },
    {
      "characterId": "friend",
      "role": "ai_partner",
      "name": "하은",
      "personality": "friendly"
    }
  ],
  "emotionRules": [
    {
      "emotion": "positive",
      "keywords": [
        "좋아",
        "재밌어",
        "기뻐",
        "고마워"
      ],
      "feedback": "밝은 마음을 말로 표현했어요."
    },
    {
      "emotion": "negative",
      "keywords": [
        "싫어",
        "무서워",
        "속상해",
        "화나"
      ],
      "feedback": "불편한 마음을 말로 표현한 것은 좋아요."
    },
    {
      "emotion": "passive",
      "keywords": [
        "몰라",
        "음",
        "..."
      ],
      "feedback": "짧게라도 반응하려는 시도를 확인했어요."
    }
  ],
  "scenarioId": "playroom_conflict_001",
  "title": "친구가 내 장난감을 가져갔을 때 차례를 말하기",
  "category": "conflict_resolution",
  "description": "친구가 장난감을 가져갔을 때 빼앗지 않고 차례를 말로 조율하는 시나리오",
  "learningGoal": [
    "내 차례 말하기",
    "친구에게 돌려달라고 말하기",
    "말로 갈등 해결하기"
  ],
  "targetSkills": [
    "conflict_resolution",
    "turn_taking"
  ],
  "context": {
    "place": "kindergarten_playroom",
    "situation": "아동이 쓰던 장난감을 친구가 가져간 상황",
    "background": "친구가 장난감을 들고 놀이를 시작하려고 한다."
  },
  "dialogueFlow": [
    {
      "stepId": "step_001",
      "speaker": "ai_partner",
      "utterance": "나도 이 장난감 쓰고 싶어.",
      "expectedUserIntent": [
        "turn_taking",
        "conflict_repair"
      ],
      "acceptableResponses": [
        "내 차례야",
        "다 쓰면 줘",
        "나도 쓰고 싶어"
      ],
      "hint": "차례를 말로 알려보세요.",
      "emotionTarget": "negative",
      "nextStep": "step_002"
    },
    {
      "stepId": "step_002",
      "speaker": "ai_partner",
      "utterance": "아, 네가 쓰고 있었구나.",
      "expectedUserIntent": [
        "conversation_continuation",
        "sharing"
      ],
      "acceptableResponses": [
        "응",
        "끝나면 줄게",
        "같이 쓰자"
      ],
      "hint": "어떻게 같이 쓸지 말해보세요.",
      "emotionTarget": "neutral",
      "nextStep": "end"
    }
  ],
  "evaluationCriteria": {
    "intentMatched": true,
    "minUtteranceLength": 1,
    "requiredSkill": [
      "conflict_resolution",
      "turn_taking"
    ],
    "scoringRule": {
      "intentMatch": 40,
      "contextAppropriate": 30,
      "emotionExpression": 10,
      "conversationContinuity": 20
    }
  },
  "metadata": {
    "version": "0.1.0",
    "createdBy": "team",
    "lastUpdated": "2026-06-07",
    "tags": [
      "mvp",
      "peer-interaction",
      "conflict_resolution",
      "kindergarten_playroom"
    ]
  }
}
