{
  "difficulty": "easy",
  "targetAge": {
    "min": 5,
    "max": 8
  },
  "characters": [
    {
      "characterId": "child",
      "role": "learner",
      "name": "사용자"
    },
    {
      "characterId": "friend",
      "role": "ai_partner",
      "name": "하은",
      "personality": "friendly"
    }
  ],
  "emotionRules": [
    {
      "emotion": "positive",
      "keywords": [
        "좋아",
        "재밌어",
        "기뻐",
        "고마워"
      ],
      "feedback": "밝은 마음을 말로 표현했어요."
    },
    {
      "emotion": "negative",
      "keywords": [
        "싫어",
        "무서워",
        "속상해",
        "화나"
      ],
      "feedback": "불편한 마음을 말로 표현한 것은 좋아요."
    },
    {
      "emotion": "passive",
      "keywords": [
        "몰라",
        "음",
        "..."
      ],
      "feedback": "짧게라도 반응하려는 시도를 확인했어요."
    }
  ],
  "scenarioId": "playroom_help_001",
  "title": "장난감 상자가 잘 안 열려서 친구에게 도와달라고 말하기",
  "category": "help_request_refusal",
  "description": "장난감 상자가 열리지 않을 때 친구에게 도움을 요청하는 시나리오",
  "learningGoal": [
    "도움이 필요함을 말하기",
    "친구에게 부탁하기",
    "도움을 받은 뒤 반응하기"
  ],
  "targetSkills": [
    "requesting_help",
    "conversation_continuation"
  ],
  "context": {
    "place": "kindergarten_playroom",
    "situation": "장난감 상자 뚜껑이 잘 열리지 않는 상황",
    "background": "친구가 옆에서 다른 장난감을 정리하고 있다."
  },
  "dialogueFlow": [
    {
      "stepId": "step_001",
      "speaker": "ai_partner",
      "utterance": "상자가 잘 안 열리네.",
      "expectedUserIntent": [
        "request_help"
      ],
      "acceptableResponses": [
        "도와줘",
        "같이 열어줄래",
        "도와줄래"
      ],
      "hint": "친구에게 도와달라고 말해보세요.",
      "emotionTarget": "neutral",
      "nextStep": "step_002"
    },
    {
      "stepId": "step_002",
      "speaker": "ai_partner",
      "utterance": "응, 내가 같이 해볼게.",
      "expectedUserIntent": [
        "positive_emotion",
        "conversation_continuation"
      ],
      "acceptableResponses": [
        "고마워",
        "좋아",
        "응"
      ],
      "hint": "도와준 친구에게 대답해보세요.",
      "emotionTarget": "positive",
      "nextStep": "end"
    }
  ],
  "evaluationCriteria": {
    "intentMatched": true,
    "minUtteranceLength": 1,
    "requiredSkill": [
      "requesting_help",
      "conversation_continuation"
    ],
    "scoringRule": {
      "intentMatch": 40,
      "contextAppropriate": 30,
      "emotionExpression": 10,
      "conversationContinuity": 20
    }
  },
  "metadata": {
    "version": "0.1.0",
    "createdBy": "team",
    "lastUpdated": "2026-06-07",
    "tags": [
      "mvp",
      "peer-interaction",
      "help_request_refusal",
      "kindergarten_playroom"
    ]
  }
}
