{
  "difficulty": "easy",
  "targetAge": {
    "min": 5,
    "max": 8
  },
  "characters": [
    {
      "characterId": "child",
      "role": "learner",
      "name": "사용자"
    },
    {
      "characterId": "friend",
      "role": "ai_partner",
      "name": "하은",
      "personality": "friendly"
    }
  ],
  "emotionRules": [
    {
      "emotion": "positive",
      "keywords": [
        "좋아",
        "재밌어",
        "기뻐",
        "고마워"
      ],
      "feedback": "밝은 마음을 말로 표현했어요."
    },
    {
      "emotion": "negative",
      "keywords": [
        "싫어",
        "무서워",
        "속상해",
        "화나"
      ],
      "feedback": "불편한 마음을 말로 표현한 것은 좋아요."
    },
    {
      "emotion": "passive",
      "keywords": [
        "몰라",
        "음",
        "..."
      ],
      "feedback": "짧게라도 반응하려는 시도를 확인했어요."
    }
  ],
  "scenarioId": "playground_emotion_001",
  "title": "친구와 그네를 타서 기쁜 마음 말하기",
  "category": "emotion_expression",
  "description": "아동이 친구와 그네를 타며 즐거운 감정을 말로 표현하는 시나리오",
  "learningGoal": [
    "기쁜 마음 표현하기",
    "놀이 감정 말하기",
    "친구의 말에 반응하기"
  ],
  "targetSkills": [
    "emotion_expression",
    "conversation_continuation"
  ],
  "context": {
    "place": "playground",
    "situation": "친구와 번갈아 그네를 타고 있는 상황",
    "background": "친구가 그네 옆에서 웃으며 기다리고 있다."
  },
  "dialogueFlow": [
    {
      "stepId": "step_001",
      "speaker": "ai_partner",
      "utterance": "그네 타니까 기분이 어때?",
      "expectedUserIntent": [
        "emotion_response",
        "positive_emotion"
      ],
      "acceptableResponses": [
        "좋아",
        "재밌어",
        "기뻐",
        "신나"
      ],
      "hint": "기분을 한 단어로 말해보세요.",
      "emotionTarget": "positive",
      "nextStep": "step_002"
    },
    {
      "stepId": "step_002",
      "speaker": "ai_partner",
      "utterance": "나도 재밌어! 한 번 더 탈래?",
      "expectedUserIntent": [
        "accept_invitation",
        "reject_invitation"
      ],
      "acceptableResponses": [
        "응",
        "좋아",
        "아니",
        "쉴래"
      ],
      "hint": "더 타고 싶은지 말해보세요.",
      "emotionTarget": "positive",
      "nextStep": "end"
    }
  ],
  "evaluationCriteria": {
    "intentMatched": true,
    "minUtteranceLength": 1,
    "requiredSkill": [
      "emotion_expression",
      "conversation_continuation"
    ],
    "scoringRule": {
      "intentMatch": 40,
      "contextAppropriate": 30,
      "emotionExpression": 30,
      "conversationContinuity": 0
    }
  },
  "metadata": {
    "version": "0.1.0",
    "createdBy": "team",
    "lastUpdated": "2026-06-07",
    "tags": [
      "mvp",
      "peer-interaction",
      "emotion_expression",
      "playground"
    ]
  }
}
