{
  "difficulty": "easy",
  "targetAge": {
    "min": 5,
    "max": 8
  },
  "characters": [
    {
      "characterId": "child",
      "role": "learner",
      "name": "사용자"
    },
    {
      "characterId": "friend",
      "role": "ai_partner",
      "name": "하준",
      "personality": "friendly"
    }
  ],
  "emotionRules": [
    {
      "emotion": "positive",
      "keywords": [
        "좋아",
        "재밌어",
        "기뻐",
        "고마워"
      ],
      "feedback": "밝은 마음을 말로 표현했어요."
    },
    {
      "emotion": "negative",
      "keywords": [
        "싫어",
        "무서워",
        "속상해",
        "화나"
      ],
      "feedback": "불편한 마음을 말로 표현한 것은 좋아요."
    },
    {
      "emotion": "passive",
      "keywords": [
        "몰라",
        "음",
        "..."
      ],
      "feedback": "짧게라도 반응하려는 시도를 확인했어요."
    }
  ],
  "scenarioId": "playroom_help_002",
  "title": "블록을 높이 쌓고 싶은데 어려워서 친구에게 같이 하자고 말하기",
  "category": "help_request_refusal",
  "description": "블록을 높이 쌓기 어려운 상황에서 친구에게 함께하자고 요청하는 시나리오",
  "learningGoal": [
    "같이 하자고 말하기",
    "어려움을 표현하기",
    "협동 놀이 시작하기"
  ],
  "targetSkills": [
    "requesting_help",
    "sharing"
  ],
  "context": {
    "place": "kindergarten_playroom",
    "situation": "아동이 블록 탑을 높이 쌓고 싶지만 자꾸 무너지는 상황",
    "background": "친구가 옆에서 블록을 가지고 놀고 있다."
  },
  "dialogueFlow": [
    {
      "stepId": "step_001",
      "speaker": "ai_partner",
      "utterance": "블록 탑이 자꾸 쓰러지네.",
      "expectedUserIntent": [
        "request_help"
      ],
      "acceptableResponses": [
        "같이 해줄래",
        "도와줘",
        "같이 쌓자"
      ],
      "hint": "친구에게 같이 하자고 말해보세요.",
      "emotionTarget": "neutral",
      "nextStep": "step_002"
    },
    {
      "stepId": "step_002",
      "speaker": "ai_partner",
      "utterance": "좋아. 나는 아래를 잡아줄게.",
      "expectedUserIntent": [
        "sharing",
        "conversation_continuation"
      ],
      "acceptableResponses": [
        "고마워",
        "나는 위에 놓을게",
        "좋아"
      ],
      "hint": "친구와 어떻게 할지 말해보세요.",
      "emotionTarget": "positive",
      "nextStep": "end"
    }
  ],
  "evaluationCriteria": {
    "intentMatched": true,
    "minUtteranceLength": 1,
    "requiredSkill": [
      "requesting_help",
      "sharing"
    ],
    "scoringRule": {
      "intentMatch": 40,
      "contextAppropriate": 30,
      "emotionExpression": 10,
      "conversationContinuity": 20
    }
  },
  "metadata": {
    "version": "0.1.0",
    "createdBy": "team",
    "lastUpdated": "2026-06-07",
    "tags": [
      "mvp",
      "peer-interaction",
      "help_request_refusal",
      "kindergarten_playroom"
    ]
  }
}
